{
  "schema_version": "1.0",
  "artifact_type": "provisional_visual_asset_record",
  "deck_id": "D03",
  "slide_id": "S02",
  "element_id": "EL-S02-V01",
  "visual_ref": "S02-V01",
  "generated_layer_sha256": "8ea5f40b710fe39a6e0e2dabcac0f1cb6199cd7c14c7c1e8484d4543fa070c1f",
  "crop_bbox": {
    "x": 300,
    "y": 2100,
    "w": 9200,
    "h": 6000
  },
  "asset_path": "provisional-S02-V01.png",
  "asset_sha256": "a5ff83d79917991c19640da9fc09a5a92762d8ccd7e49b34e1d31bf644acee50",
  "background_separation": "clean_local_background",
  "extraction_quality": "pass",
  "status": "provisional"
}
